{
  "version": "2.0.0",
  "generatedAt": "2026-09-03T00:00:00Z",
  "disclaimer": {
    "en": "Reference only; verify with the official gazette/order or your DDO.",
    "hi": "केवल संदर्भ के लिए; सरकारी राजपत्र/आदेश या अपने डीडीओ से सत्यापित करें।"
  },
  "terms": [
    {
      "id": "letter",
      "category": "form",
      "en": "Letter",
      "hi": "पत्र",
      "csmopRef": "8.4(1)",
      "source": {
        "name": "केंद्रीय सचिवालय कार्यालय प्रक्रिया नियमावली, 2022 (16वाँ संस्करण), प्रशासनिक सुधार और लोक शिकायत विभाग",
        "url": "https://www.darpg.gov.in/static/uploads/2025/10/8b5d6eb6c7c47bc69e271e25f1c2cc43.pdf",
        "reference": "CSMOP 2022, sixteenth edition (Hindi issue)",
        "dated": "2022-08-05"
      },
      "fetchedAt": "2026-09-03T00:00:00Z",
      "verify": false
    },
    {
      "id": "demi-official-letter",
      "category": "form",
      "en": "Demi-official letter",
      "hi": "अर्ध-सरकारी पत्र",
      "alsoHi": [
        "अर्ध-शासकीय पत्र",
        "डी.ओ. पत्र"
      ],
      "note": {
        "en": "The manual prints अर्ध-सरकारी. अर्ध-शासकीय is the older and still widely used form.",
        "hi": "नियमावली में अर्ध-सरकारी छपा है। अर्ध-शासकीय पुराना और अब भी प्रचलित रूप है।"
      },
      "csmopRef": "8.4(2)",
      "source": {
        "name": "केंद्रीय सचिवालय कार्यालय प्रक्रिया नियमावली, 2022 (16वाँ संस्करण), प्रशासनिक सुधार और लोक शिकायत विभाग",
        "url": "https://www.darpg.gov.in/static/uploads/2025/10/8b5d6eb6c7c47bc69e271e25f1c2cc43.pdf",
        "reference": "CSMOP 2022, sixteenth edition (Hindi issue)",
        "dated": "2022-08-05"
      },
      "fetchedAt": "2026-09-03T00:00:00Z",
      "verify": false
    },
    {
      "id": "office-memorandum",
      "category": "form",
      "en": "Office Memorandum",
      "hi": "कार्यालय ज्ञापन",
      "csmopRef": "8.4(3), Appendix 8.1",
      "source": {
        "name": "केंद्रीय सचिवालय कार्यालय प्रक्रिया नियमावली, 2022 (16वाँ संस्करण), प्रशासनिक सुधार और लोक शिकायत विभाग",
        "url": "https://www.darpg.gov.in/static/uploads/2025/10/8b5d6eb6c7c47bc69e271e25f1c2cc43.pdf",
        "reference": "CSMOP 2022, sixteenth edition (Hindi issue)",
        "dated": "2022-08-05"
      },
      "fetchedAt": "2026-09-03T00:00:00Z",
      "verify": false
    },
    {
      "id": "office-order",
      "category": "form",
      "en": "Office Order",
      "hi": "कार्यालय आदेश",
      "csmopRef": "8.4(4), Appendix 8.1",
      "source": {
        "name": "केंद्रीय सचिवालय कार्यालय प्रक्रिया नियमावली, 2022 (16वाँ संस्करण), प्रशासनिक सुधार और लोक शिकायत विभाग",
        "url": "https://www.darpg.gov.in/static/uploads/2025/10/8b5d6eb6c7c47bc69e271e25f1c2cc43.pdf",
        "reference": "CSMOP 2022, sixteenth edition (Hindi issue)",
        "dated": "2022-08-05"
      },
      "fetchedAt": "2026-09-03T00:00:00Z",
      "verify": false
    },
    {
      "id": "order",
      "category": "form",
      "en": "Order",
      "hi": "आदेश",
      "csmopRef": "8.4(5), Appendix 8.1",
      "source": {
        "name": "केंद्रीय सचिवालय कार्यालय प्रक्रिया नियमावली, 2022 (16वाँ संस्करण), प्रशासनिक सुधार और लोक शिकायत विभाग",
        "url": "https://www.darpg.gov.in/static/uploads/2025/10/8b5d6eb6c7c47bc69e271e25f1c2cc43.pdf",
        "reference": "CSMOP 2022, sixteenth edition (Hindi issue)",
        "dated": "2022-08-05"
      },
      "fetchedAt": "2026-09-03T00:00:00Z",
      "verify": false
    },
    {
      "id": "id-note",
      "category": "form",
      "en": "Inter-Departmental note",
      "hi": "अंतर-विभागीय टिप्पणी",
      "alsoHi": [
        "अशासकीय टिप्पणी",
        "यू.ओ. टिप्पणी"
      ],
      "note": {
        "en": "CSMOP 2022 renamed the U.O. note the Inter-Departmental note; अशासकीय टिप्पणी is what the earlier editions and most sections still call it.",
        "hi": "सीएसएमओपी 2022 ने यू.ओ. टिप्पणी का नाम बदलकर अंतर-विभागीय टिप्पणी कर दिया; पुराने संस्करणों और अधिकांश अनुभागों में इसे अब भी अशासकीय टिप्पणी कहा जाता है।"
      },
      "csmopRef": "8.1, Appendix 8.1",
      "source": {
        "name": "केंद्रीय सचिवालय कार्यालय प्रक्रिया नियमावली, 2022 (16वाँ संस्करण), प्रशासनिक सुधार और लोक शिकायत विभाग",
        "url": "https://www.darpg.gov.in/static/uploads/2025/10/8b5d6eb6c7c47bc69e271e25f1c2cc43.pdf",
        "reference": "CSMOP 2022, sixteenth edition (Hindi issue)",
        "dated": "2022-08-05"
      },
      "fetchedAt": "2026-09-03T00:00:00Z",
      "verify": false
    },
    {
      "id": "notification",
      "category": "form",
      "en": "Notification",
      "hi": "अधिसूचना",
      "csmopRef": "8.4(6), Appendix 8.1",
      "source": {
        "name": "केंद्रीय सचिवालय कार्यालय प्रक्रिया नियमावली, 2022 (16वाँ संस्करण), प्रशासनिक सुधार और लोक शिकायत विभाग",
        "url": "https://www.darpg.gov.in/static/uploads/2025/10/8b5d6eb6c7c47bc69e271e25f1c2cc43.pdf",
        "reference": "CSMOP 2022, sixteenth edition (Hindi issue)",
        "dated": "2022-08-05"
      },
      "fetchedAt": "2026-09-03T00:00:00Z",
      "verify": false
    },
    {
      "id": "resolution",
      "category": "form",
      "en": "Resolution",
      "hi": "संकल्प",
      "csmopRef": "8.4(7)",
      "source": {
        "name": "केंद्रीय सचिवालय कार्यालय प्रक्रिया नियमावली, 2022 (16वाँ संस्करण), प्रशासनिक सुधार और लोक शिकायत विभाग",
        "url": "https://www.darpg.gov.in/static/uploads/2025/10/8b5d6eb6c7c47bc69e271e25f1c2cc43.pdf",
        "reference": "CSMOP 2022, sixteenth edition (Hindi issue)",
        "dated": "2022-08-05"
      },
      "fetchedAt": "2026-09-03T00:00:00Z",
      "verify": false
    },
    {
      "id": "press-communique",
      "category": "form",
      "en": "Press Communiqué / Press Note",
      "hi": "प्रेस विज्ञप्ति / प्रेस नोट",
      "csmopRef": "8.4(8)",
      "source": {
        "name": "केंद्रीय सचिवालय कार्यालय प्रक्रिया नियमावली, 2022 (16वाँ संस्करण), प्रशासनिक सुधार और लोक शिकायत विभाग",
        "url": "https://www.darpg.gov.in/static/uploads/2025/10/8b5d6eb6c7c47bc69e271e25f1c2cc43.pdf",
        "reference": "CSMOP 2022, sixteenth edition (Hindi issue)",
        "dated": "2022-08-05"
      },
      "fetchedAt": "2026-09-03T00:00:00Z",
      "verify": false
    },
    {
      "id": "endorsement",
      "category": "form",
      "en": "Endorsement",
      "hi": "पृष्ठांकन",
      "csmopRef": "8.4(9), Appendix 8.1",
      "source": {
        "name": "केंद्रीय सचिवालय कार्यालय प्रक्रिया नियमावली, 2022 (16वाँ संस्करण), प्रशासनिक सुधार और लोक शिकायत विभाग",
        "url": "https://www.darpg.gov.in/static/uploads/2025/10/8b5d6eb6c7c47bc69e271e25f1c2cc43.pdf",
        "reference": "CSMOP 2022, sixteenth edition (Hindi issue)",
        "dated": "2022-08-05"
      },
      "fetchedAt": "2026-09-03T00:00:00Z",
      "verify": false
    },
    {
      "id": "minutes",
      "category": "form",
      "en": "Minutes",
      "hi": "कार्यवृत्त",
      "csmopRef": "8.4(10)",
      "source": {
        "name": "Saral Prashasanik Shabdavali, Department of Official Language",
        "url": "https://rajbhasha.gov.in/sites/default/files/saralshabdavali.pdf",
        "reference": "Central Translation Bureau, Rajbhasha Vibhag"
      },
      "fetchedAt": "2026-09-03T00:00:00Z",
      "verify": true
    },
    {
      "id": "circular",
      "category": "form",
      "en": "Circular",
      "hi": "परिपत्र",
      "note": {
        "en": "CSMOP 8.4 does not list the circular; it is an Office Memorandum addressed to everyone. The Hindi is the Department of Official Language's.",
        "hi": "सीएसएमओपी 8.4 में परिपत्र सूचीबद्ध नहीं है; यह सभी को संबोधित कार्यालय ज्ञापन है। हिंदी राजभाषा विभाग की है।"
      },
      "source": {
        "name": "Saral Prashasanik Shabdavali, Department of Official Language",
        "url": "https://rajbhasha.gov.in/sites/default/files/saralshabdavali.pdf",
        "reference": "Central Translation Bureau, Rajbhasha Vibhag"
      },
      "fetchedAt": "2026-09-03T00:00:00Z",
      "verify": true
    },
    {
      "id": "noting",
      "category": "form",
      "en": "Note / noting on a file",
      "hi": "टिप्पणी",
      "csmopRef": "7.1",
      "source": {
        "name": "केंद्रीय सचिवालय कार्यालय प्रक्रिया नियमावली, 2022 (16वाँ संस्करण), प्रशासनिक सुधार और लोक शिकायत विभाग",
        "url": "https://www.darpg.gov.in/static/uploads/2025/10/8b5d6eb6c7c47bc69e271e25f1c2cc43.pdf",
        "reference": "CSMOP 2022, sixteenth edition (Hindi issue)",
        "dated": "2022-08-05"
      },
      "fetchedAt": "2026-09-03T00:00:00Z",
      "verify": false
    },
    {
      "id": "number",
      "category": "part",
      "en": "Number",
      "hi": "संख्या",
      "csmopRef": "Appendix 8.1",
      "source": {
        "name": "केंद्रीय सचिवालय कार्यालय प्रक्रिया नियमावली, 2022 (16वाँ संस्करण), प्रशासनिक सुधार और लोक शिकायत विभाग",
        "url": "https://www.darpg.gov.in/static/uploads/2025/10/8b5d6eb6c7c47bc69e271e25f1c2cc43.pdf",
        "reference": "CSMOP 2022, sixteenth edition (Hindi issue)",
        "dated": "2022-08-05"
      },
      "fetchedAt": "2026-09-03T00:00:00Z",
      "verify": false
    },
    {
      "id": "government-of-india",
      "category": "part",
      "en": "Government of India",
      "hi": "भारत सरकार",
      "csmopRef": "Appendix 8.1",
      "source": {
        "name": "केंद्रीय सचिवालय कार्यालय प्रक्रिया नियमावली, 2022 (16वाँ संस्करण), प्रशासनिक सुधार और लोक शिकायत विभाग",
        "url": "https://www.darpg.gov.in/static/uploads/2025/10/8b5d6eb6c7c47bc69e271e25f1c2cc43.pdf",
        "reference": "CSMOP 2022, sixteenth edition (Hindi issue)",
        "dated": "2022-08-05"
      },
      "fetchedAt": "2026-09-03T00:00:00Z",
      "verify": false
    },
    {
      "id": "ministry",
      "category": "part",
      "en": "Ministry",
      "hi": "मंत्रालय",
      "csmopRef": "Appendix 8.1",
      "source": {
        "name": "केंद्रीय सचिवालय कार्यालय प्रक्रिया नियमावली, 2022 (16वाँ संस्करण), प्रशासनिक सुधार और लोक शिकायत विभाग",